{
  "id": "case-42",
  "type": "case",
  "kind": "resource",
  "labels": {
    "severity": "high",
    "tenant": "demo"
  },
  "properties": {
    "title": "Investigate ingress alarm",
    "state": "triaged"
  },
  "links": [
    {
      "link_type": "attached_to",
      "target_ref": {
        "contract_id": "gx.evidence",
        "resource_type": "evidence",
        "resource_id": "evidence-17"
      }
    }
  ],
  "revision": 3,
  "created_at": "2026-03-07T12:00:00Z",
  "updated_at": "2026-03-07T12:15:00Z"
}
